{
  "$schema": "../../.schema/v1/relation.json",
  "kind": "relation",
  "id": "01M2APHMY54GY92EJBYBWWYS5T",
  "name": "inventory hold is kept at warehouse",
  "package": "01M1KRHM5ECKGZXYXAD5RVR3SY",
  "description": "Warehouse where it applies.",
  "category": "01M23SKM8QFT1AZMAWCDFTJRMS",
  "ends": [
    {
      "id": "01M2K4DKCBHV8ZP184RS88CZ5K",
      "entity": "01M1PN7QBBJ001FSBR7DTP2QS6",
      "role": "warehouse",
      "navigation": "warehouse",
      "min": 1,
      "max": 1,
      "onDelete": "restrict"
    },
    {
      "id": "01M25AKERWCFT52T7KQMNBGA31",
      "entity": "01M36B5S17JHX2WD4MPTH5TREK",
      "role": "inventoryHolds"
    }
  ]
}
