{
  "$schema": "../../.schema/v1/relation.json",
  "kind": "relation",
  "id": "01M2NAFA58BBVBQP06DBGMZPXD",
  "name": "inventory item is put away in default bin",
  "package": "01M1KRHM5ECKGZXYXAD5RVR3SY",
  "description": "Pick face of the product.",
  "category": "01M23SKM8QFT1AZMAWCDFTJRMS",
  "ends": [
    {
      "id": "01M1ST4FX5N77T6ZB5HQHGEE3Q",
      "entity": "01M23889DSDTV8CMFDQXJCF0NM",
      "role": "defaultBin",
      "navigation": "defaultBin",
      "max": 1,
      "onDelete": "set-null"
    },
    {
      "id": "01M1Q34TDX27685RBJF6WESSWM",
      "entity": "01M2DF9XGX67C72G614BCTGVMB",
      "role": "inventoryItems"
    }
  ]
}
