{
  "$schema": "../../.schema/v1/relation.json",
  "kind": "relation",
  "id": "01M37K4FBJCYECM9WZG48PWMGT",
  "name": "stock transfer lines",
  "package": "01M1KRHM5ECKGZXYXAD5RVR3SY",
  "relationKind": "composition",
  "description": "Products transferred.",
  "category": "01M23SKM8QFT1AZMAWCDFTJRMS",
  "ends": [
    {
      "id": "01M26NEFGBVFD42MZ5R6N8BG4X",
      "entity": "01M2GFXG35ZVVY61FKPBPFYVJZ",
      "role": "stockTransfer",
      "navigation": "stockTransfer",
      "min": 1,
      "max": 1,
      "onDelete": "cascade"
    },
    {
      "id": "01M1T9YP3NNQHT3JK59ACDZJ49",
      "entity": "01M1XGAKD7QF42QNGG4SGXZZVH",
      "role": "lines",
      "navigation": "lines"
    }
  ]
}
