{
  "$schema": "../../.schema/v1/relation.json",
  "kind": "relation",
  "id": "01M1MTPRNVH6AC4CPJCVXS3K5P",
  "name": "product is made by manufacturer",
  "package": "01M24CVQK5A8SM04F7S0Z3MAMA",
  "description": "Who makes the product.",
  "category": "01M2W72KPZ37Q9NDMTV0Q2SGH0",
  "ends": [
    {
      "id": "01M1FZBHGWAGAB74Z2834ZACMN",
      "entity": "01M2GNPY4VHZ54THRVC2PFYTY0",
      "role": "manufacturer",
      "navigation": "manufacturer",
      "max": 1,
      "onDelete": "set-null"
    },
    {
      "id": "01M2HY33QBJ4MM170KJ6B9DNJ0",
      "entity": "01M20RAEF2QZ5W8HV57RBX5PQV",
      "role": "products"
    }
  ]
}
