{
  "$schema": "../../.schema/v1/relation.json",
  "kind": "relation",
  "id": "01M1YS8NV3J9QDX0RYT6BWNCB6",
  "name": "purchase order supplier",
  "package": "01M1HBJ9DHC9YMPY1A6RCV4TTG",
  "description": "Supplier ordered from.",
  "category": "01M1Z1CM7DCRF0KE9WXCPSYXSX",
  "ends": [
    {
      "id": "01M1V4CCJJDWB0EGC5WN3KHR4S",
      "entity": "01M2A5WW8NFWJS1V5NFRKCBNYV",
      "role": "supplier",
      "navigation": "supplier",
      "min": 1,
      "max": 1,
      "onDelete": "restrict"
    },
    {
      "id": "01M2QP1TCHQZ2YGW3XFQXTWR5A",
      "entity": "01M2PKYF42VBPP64C8WV8TWXZ6",
      "role": "purchaseOrders",
      "navigation": "purchaseOrders"
    }
  ]
}
