{
  "$schema": "../../.schema/v1/relation.json",
  "kind": "relation",
  "id": "01M1T07TCTAPTHSVX1XXJD47ZZ",
  "name": "product lifecycle event is changed by user account",
  "package": "01M24CVQK5A8SM04F7S0Z3MAMA",
  "description": "Who changed it.",
  "category": "01M2W72KPZ37Q9NDMTV0Q2SGH0",
  "ends": [
    {
      "id": "01M269KHD8NTTGZF7EHTEPWQPK",
      "entity": "01M2CMF5JR3GW828G267AZ0M1E",
      "role": "changedBy",
      "navigation": "changedBy",
      "max": 1,
      "onDelete": "set-null"
    },
    {
      "id": "01M2Q9J7F4T0JGEEMN3QB8KZXH",
      "entity": "01M2GPE1118GZA4QY5E0XNMV9H",
      "role": "productLifecycleEvents"
    }
  ]
}
