{
  "$schema": "../../.schema/v1/relation.json",
  "kind": "relation",
  "id": "01M1TDNF61V72D3WTS1BPM17J4",
  "name": "journal line posts to ledger account",
  "package": "01M1EYTWAA6REG1KFCR9N7XQ27",
  "description": "Account posted to.",
  "category": "01M1E9BTZZTKGKC2S6YTG3CKTZ",
  "ends": [
    {
      "id": "01M1KFCZM6QF2085GJABSM7D0Q",
      "entity": "01M33CZQC491X54XW35063THC2",
      "role": "ledgerAccount",
      "navigation": "ledgerAccount",
      "min": 1,
      "max": 1,
      "onDelete": "restrict"
    },
    {
      "id": "01M1FWYZH4YMPAWBEGEH543JVG",
      "entity": "01M2EE2G117QN4KHVZYDCHGQP6",
      "role": "journalLines"
    }
  ]
}
