{
  "$schema": "../../.schema/v1/relation.json",
  "kind": "relation",
  "id": "01JVSR00000000000000000001",
  "name": "located in",
  "ends": [
    {
      "id": "01JVSR00000000000000000011",
      "entity": "01JVSE00000000000000000003",
      "role": "city"
    },
    {
      "id": "01JVSR00000000000000000012",
      "entity": "01JVSE00000000000000000002",
      "role": "country",
      "min": 1,
      "max": 1
    }
  ]
}
