{
  "$schema": "../../.schema/v1/relation.json",
  "kind": "relation",
  "id": "01M1RP3BDM6DHEM6N1HS9Q843J",
  "name": "service case customer",
  "package": "01M2HKCGBASZHCTZ8CKTBVG8RB",
  "description": "Customer.",
  "category": "01M1QNVKDMDN8496P6K46TZG03",
  "ends": [
    {
      "id": "01M33PWX68K11RCBKG10B0XBGS",
      "entity": "01M1ECZKYNSKVNCWW2XM34E20X",
      "role": "customer",
      "navigation": "customer",
      "min": 1,
      "max": 1,
      "onDelete": "restrict"
    },
    {
      "id": "01M34ZWKXSVETV0NRJK0TG7942",
      "entity": "01M2NPNWREHQKBV15PJMWZPKRK",
      "role": "serviceCases",
      "navigation": "serviceCases"
    }
  ]
}
