{
  "$schema": "../../.schema/v1/relation.json",
  "kind": "relation",
  "id": "01M2KN78DVMHZSS6A76H0RYBBB",
  "name": "sales order applied promotions",
  "package": "01M28AC84B1SVDDC2EY42YJNZ8",
  "relationKind": "composition",
  "description": "Promotions applied to the order.",
  "category": "01M1DDZYJWHS2VRM9BAYTT4SKZ",
  "ends": [
    {
      "id": "01M2KRMZJSQZQG36QCQW3JX81E",
      "entity": "01M1GBW3NDKS6WCM5FAXYVHV7B",
      "role": "salesOrder",
      "navigation": "salesOrder",
      "min": 1,
      "max": 1,
      "onDelete": "cascade"
    },
    {
      "id": "01M1PPSY7ZPZTAXSQDHCJMWJ78",
      "entity": "01M2RAWA2R3YTRTN2NZYY3W84T",
      "role": "appliedPromotions",
      "navigation": "appliedPromotions"
    }
  ]
}
