{
  "$schema": "../../.schema/v1/relation.json",
  "kind": "relation",
  "id": "01M298XZCQYBXG0KHPBST6VG4J",
  "name": "agreement line is for product",
  "package": "01M1DE7C8B6C6SJ56R6QBZQJBT",
  "description": "Covered product.",
  "category": "01M1DAV43K3Q185051SG2CRJSN",
  "ends": [
    {
      "id": "01M2BJC4ADYZPY7NP7A7Z5CJQ2",
      "entity": "01M20RAEF2QZ5W8HV57RBX5PQV",
      "role": "product",
      "navigation": "product",
      "max": 1,
      "onDelete": "set-null"
    },
    {
      "id": "01M20M59YDB4FPTV3J1FFTWCTQ",
      "entity": "01M23MARQX94BHXK3Y4EB4Q77C",
      "role": "agreementLines"
    }
  ]
}
