{
  "$schema": "../../.schema/v1/relation.json",
  "kind": "relation",
  "id": "01M1Y6DS5FG8RYMSF9H137R7K2",
  "name": "order hold released by",
  "package": "01M28AC84B1SVDDC2EY42YJNZ8",
  "description": "Who released it.",
  "category": "01M1DDZYJWHS2VRM9BAYTT4SKZ",
  "ends": [
    {
      "id": "01M21DV79V1M4H0M8S33V1T3J4",
      "entity": "01M2CMF5JR3GW828G267AZ0M1E",
      "role": "releasedBy",
      "navigation": "releasedBy",
      "max": 1,
      "onDelete": "set-null"
    },
    {
      "id": "01M2V5BVM5VVA64XRDT9DGQNGD",
      "entity": "01M1GGGF7MKSKSSN9E4MQGWNG4",
      "role": "orderHolds"
    }
  ]
}
