{
  "$schema": "../../.schema/v1/relation.json",
  "kind": "relation",
  "id": "01M2WGRSPAVT3FQ03ZCEJDH3JJ",
  "name": "supplier quote supplier",
  "package": "01M1HBJ9DHC9YMPY1A6RCV4TTG",
  "description": "Quoting supplier.",
  "category": "01M1Z1CM7DCRF0KE9WXCPSYXSX",
  "ends": [
    {
      "id": "01M2F34XR12AXMJM9SXC0RF87Z",
      "entity": "01M2A5WW8NFWJS1V5NFRKCBNYV",
      "role": "supplier",
      "navigation": "supplier",
      "min": 1,
      "max": 1,
      "onDelete": "restrict"
    },
    {
      "id": "01M35AFVZDCC5KA87GWXS9K7CB",
      "entity": "01M2XJ2JS9QHPBPRS652GKRX01",
      "role": "supplierQuotes"
    }
  ]
}
