{
  "$schema": "../../.schema/v1/relation.json",
  "kind": "relation",
  "id": "01M1KEH6QCFA1FWG0NNAHM658H",
  "name": "cart user account",
  "package": "01M28AC84B1SVDDC2EY42YJNZ8",
  "description": "Portal user who owns the cart.",
  "category": "01M1DDZYJWHS2VRM9BAYTT4SKZ",
  "ends": [
    {
      "id": "01M1YD2A8SDDYHZ857C51Z60FB",
      "entity": "01M2CMF5JR3GW828G267AZ0M1E",
      "role": "userAccount",
      "navigation": "userAccount",
      "min": 1,
      "max": 1,
      "onDelete": "restrict"
    },
    {
      "id": "01M313QG6XD38HWRSWKZZ6DXF1",
      "entity": "01M1G2XC8VHF50WCS54G3Y5R96",
      "role": "carts"
    }
  ]
}
