{
  "$schema": "../../.schema/v1/relation.json",
  "kind": "relation",
  "id": "01M1VZCDDPNE9056VDTXVNWEWS",
  "name": "party note author",
  "package": "01M1EN9FE0DH7N8JWD10TVDZ9A",
  "description": "Who wrote the note.",
  "category": "01M2T4A01BB6EGWR7CP8AM5WFQ",
  "ends": [
    {
      "id": "01M29JY177Z21WQZ2KNFAAJAJD",
      "entity": "01M2CMF5JR3GW828G267AZ0M1E",
      "role": "author",
      "navigation": "author",
      "max": 1,
      "onDelete": "set-null"
    },
    {
      "id": "01M2XTBGM491Q227JNX7GPSEZ0",
      "entity": "01M1KJSJ5XRC8BCYTQT8DNYWHD",
      "role": "partyNotes"
    }
  ]
}
