{
  "$schema": "../../.schema/v1/relation.json",
  "kind": "relation",
  "id": "01M25XA3HH3VDBW2HQQFNTHV08",
  "name": "lead converts to converted customer",
  "package": "01M1EN9FE0DH7N8JWD10TVDZ9A",
  "description": "Customer created from the lead.",
  "category": "01M2T4A01BB6EGWR7CP8AM5WFQ",
  "ends": [
    {
      "id": "01M28F54XJZ23K925C747QBQMX",
      "entity": "01M1ECZKYNSKVNCWW2XM34E20X",
      "role": "convertedCustomer",
      "navigation": "convertedCustomer",
      "max": 1,
      "onDelete": "set-null"
    },
    {
      "id": "01M1ZSCXXHM2MA67EW63TMPNMP",
      "entity": "01M2QFZSC4KWD20CENXN364C9Y",
      "role": "leads"
    }
  ]
}
